{
  "schema_version": 1,
  "template_sha256": "5a1f9af7d1be9f5a68c9be5927017f3be6fd421399b6951a5b9c17d6455b462a",
  "approval": {
    "reviewer": "Marksans Equity Research Adapter & Pack Verification",
    "approved_at": "2026-10-16T00:00:00Z",
    "template_sha256": "5a1f9af7d1be9f5a68c9be5927017f3be6fd421399b6951a5b9c17d6455b462a"
  },
  "inputs": [
    {
      "name": "meta_face_value",
      "sheet": "Data Sheet",
      "cell": "B7",
      "kind": "number",
      "unit": "INR per share",
      "minimum": 0.1,
      "maximum": 100,
      "description": "Equity share face value"
    },
    {
      "name": "meta_current_price",
      "sheet": "Data Sheet",
      "cell": "B8",
      "kind": "number",
      "unit": "INR per share",
      "minimum": 1,
      "maximum": 100000,
      "description": "Current market share price"
    },
    {
      "name": "meta_market_cap",
      "sheet": "Data Sheet",
      "cell": "B9",
      "kind": "number",
      "unit": "INR Cr",
      "minimum": 1,
      "maximum": 10000000,
      "description": "Current market capitalization (feeds implied share count in B6)"
    },
    {
      "name": "hist_sales_y1",
      "sheet": "Data Sheet",
      "cell": "G17",
      "kind": "number",
      "unit": "INR Cr",
      "minimum": 0,
      "maximum": 1000000,
      "description": "Historical revenue Y1 (FY22)"
    },
    {
      "name": "hist_sales_y2",
      "sheet": "Data Sheet",
      "cell": "H17",
      "kind": "number",
      "unit": "INR Cr",
      "minimum": 0,
      "maximum": 1000000,
      "description": "Historical revenue Y2 (FY23)"
    },
    {
      "name": "hist_sales_y3",
      "sheet": "Data Sheet",
      "cell": "I17",
      "kind": "number",
      "unit": "INR Cr",
      "minimum": 0,
      "maximum": 1000000,
      "description": "Historical revenue Y3 (FY24)"
    },
    {
      "name": "hist_sales_y4",
      "sheet": "Data Sheet",
      "cell": "J17",
      "kind": "number",
      "unit": "INR Cr",
      "minimum": 0,
      "maximum": 1000000,
      "description": "Historical revenue Y4 (FY25)"
    },
    {
      "name": "hist_sales_y5",
      "sheet": "Data Sheet",
      "cell": "K17",
      "kind": "number",
      "unit": "INR Cr",
      "minimum": 0,
      "maximum": 1000000,
      "description": "Historical revenue Y5 (FY26/TTM)"
    },
    {
      "name": "hist_depreciation_y1",
      "sheet": "Data Sheet",
      "cell": "G26",
      "kind": "number",
      "unit": "INR Cr",
      "minimum": 0,
      "maximum": 100000,
      "description": "Historical depreciation Y1"
    },
    {
      "name": "hist_depreciation_y2",
      "sheet": "Data Sheet",
      "cell": "H26",
      "kind": "number",
      "unit": "INR Cr",
      "minimum": 0,
      "maximum": 100000,
      "description": "Historical depreciation Y2"
    },
    {
      "name": "hist_depreciation_y3",
      "sheet": "Data Sheet",
      "cell": "I26",
      "kind": "number",
      "unit": "INR Cr",
      "minimum": 0,
      "maximum": 100000,
      "description": "Historical depreciation Y3"
    },
    {
      "name": "hist_depreciation_y4",
      "sheet": "Data Sheet",
      "cell": "J26",
      "kind": "number",
      "unit": "INR Cr",
      "minimum": 0,
      "maximum": 100000,
      "description": "Historical depreciation Y4"
    },
    {
      "name": "hist_depreciation_y5",
      "sheet": "Data Sheet",
      "cell": "K26",
      "kind": "number",
      "unit": "INR Cr",
      "minimum": 0,
      "maximum": 100000,
      "description": "Historical depreciation Y5"
    },
    {
      "name": "hist_tax_y1",
      "sheet": "Data Sheet",
      "cell": "G29",
      "kind": "number",
      "unit": "INR Cr",
      "minimum": -10000,
      "maximum": 100000,
      "description": "Historical tax expense Y1"
    },
    {
      "name": "hist_tax_y2",
      "sheet": "Data Sheet",
      "cell": "H29",
      "kind": "number",
      "unit": "INR Cr",
      "minimum": -10000,
      "maximum": 100000,
      "description": "Historical tax expense Y2"
    },
    {
      "name": "hist_tax_y3",
      "sheet": "Data Sheet",
      "cell": "I29",
      "kind": "number",
      "unit": "INR Cr",
      "minimum": -10000,
      "maximum": 100000,
      "description": "Historical tax expense Y3"
    },
    {
      "name": "hist_tax_y4",
      "sheet": "Data Sheet",
      "cell": "J29",
      "kind": "number",
      "unit": "INR Cr",
      "minimum": -10000,
      "maximum": 100000,
      "description": "Historical tax expense Y4"
    },
    {
      "name": "hist_tax_y5",
      "sheet": "Data Sheet",
      "cell": "K29",
      "kind": "number",
      "unit": "INR Cr",
      "minimum": -10000,
      "maximum": 100000,
      "description": "Historical tax expense Y5"
    },
    {
      "name": "hist_net_profit_y1",
      "sheet": "Data Sheet",
      "cell": "G30",
      "kind": "number",
      "unit": "INR Cr",
      "minimum": -100000,
      "maximum": 1000000,
      "description": "Historical net profit Y1"
    },
    {
      "name": "hist_net_profit_y2",
      "sheet": "Data Sheet",
      "cell": "H30",
      "kind": "number",
      "unit": "INR Cr",
      "minimum": -100000,
      "maximum": 1000000,
      "description": "Historical net profit Y2"
    },
    {
      "name": "hist_net_profit_y3",
      "sheet": "Data Sheet",
      "cell": "I30",
      "kind": "number",
      "unit": "INR Cr",
      "minimum": -100000,
      "maximum": 1000000,
      "description": "Historical net profit Y3"
    },
    {
      "name": "hist_net_profit_y4",
      "sheet": "Data Sheet",
      "cell": "J30",
      "kind": "number",
      "unit": "INR Cr",
      "minimum": -100000,
      "maximum": 1000000,
      "description": "Historical net profit Y4"
    },
    {
      "name": "hist_net_profit_y5",
      "sheet": "Data Sheet",
      "cell": "K30",
      "kind": "number",
      "unit": "INR Cr",
      "minimum": -100000,
      "maximum": 1000000,
      "description": "Historical net profit Y5"
    },
    {
      "name": "hist_borrowings_y5",
      "sheet": "Data Sheet",
      "cell": "K59",
      "kind": "number",
      "unit": "INR Cr",
      "minimum": 0,
      "maximum": 1000000,
      "description": "Latest total borrowings on Data Sheet (feeds Debt in DCF)"
    },
    {
      "name": "hist_cash_bank_y5",
      "sheet": "Data Sheet",
      "cell": "K69",
      "kind": "number",
      "unit": "INR Cr",
      "minimum": 0,
      "maximum": 1000000,
      "description": "Latest cash & bank balance on Data Sheet (feeds Cash in DCF)"
    },
    {
      "name": "bs_inventories_y4",
      "sheet": "BS",
      "cell": "M33",
      "kind": "number",
      "unit": "INR Cr",
      "minimum": 0,
      "maximum": 1000000,
      "description": "BS Inventories Y4"
    },
    {
      "name": "bs_inventories_y5",
      "sheet": "BS",
      "cell": "N33",
      "kind": "number",
      "unit": "INR Cr",
      "minimum": 0,
      "maximum": 1000000,
      "description": "BS Inventories Y5"
    },
    {
      "name": "bs_receivables_y4",
      "sheet": "BS",
      "cell": "M34",
      "kind": "number",
      "unit": "INR Cr",
      "minimum": 0,
      "maximum": 1000000,
      "description": "BS Trade Receivables Y4"
    },
    {
      "name": "bs_receivables_y5",
      "sheet": "BS",
      "cell": "N34",
      "kind": "number",
      "unit": "INR Cr",
      "minimum": 0,
      "maximum": 1000000,
      "description": "BS Trade Receivables Y5"
    },
    {
      "name": "bs_payables_y4",
      "sheet": "BS",
      "cell": "M13",
      "kind": "number",
      "unit": "INR Cr",
      "minimum": 0,
      "maximum": 1000000,
      "description": "BS Trade Payables Y4"
    },
    {
      "name": "bs_payables_y5",
      "sheet": "BS",
      "cell": "N13",
      "kind": "number",
      "unit": "INR Cr",
      "minimum": 0,
      "maximum": 1000000,
      "description": "BS Trade Payables Y5"
    },
    {
      "name": "bs_total_liabilities_y5",
      "sheet": "BS",
      "cell": "N16",
      "kind": "number",
      "unit": "INR Cr",
      "minimum": 0,
      "maximum": 10000000,
      "description": "BS Total Liabilities Y5"
    },
    {
      "name": "bs_total_assets_y5",
      "sheet": "BS",
      "cell": "N38",
      "kind": "number",
      "unit": "INR Cr",
      "minimum": 0,
      "maximum": 10000000,
      "description": "BS Total Assets Y5"
    },
    {
      "name": "cf_cfo_y5",
      "sheet": "Cash Flow",
      "cell": "N5",
      "kind": "number",
      "unit": "INR Cr",
      "minimum": -100000,
      "maximum": 1000000,
      "description": "Cash from Operating Activity Y5"
    },
    {
      "name": "cf_fixed_assets_purchased_y1",
      "sheet": "Cash Flow",
      "cell": "J15",
      "kind": "number",
      "unit": "INR Cr",
      "minimum": -1000000,
      "maximum": 0,
      "description": "Fixed assets purchased (CapEx outflow) Y1"
    },
    {
      "name": "cf_fixed_assets_purchased_y2",
      "sheet": "Cash Flow",
      "cell": "K15",
      "kind": "number",
      "unit": "INR Cr",
      "minimum": -1000000,
      "maximum": 0,
      "description": "Fixed assets purchased (CapEx outflow) Y2"
    },
    {
      "name": "cf_fixed_assets_purchased_y3",
      "sheet": "Cash Flow",
      "cell": "L15",
      "kind": "number",
      "unit": "INR Cr",
      "minimum": -1000000,
      "maximum": 0,
      "description": "Fixed assets purchased (CapEx outflow) Y3"
    },
    {
      "name": "cf_fixed_assets_purchased_y4",
      "sheet": "Cash Flow",
      "cell": "M15",
      "kind": "number",
      "unit": "INR Cr",
      "minimum": -1000000,
      "maximum": 0,
      "description": "Fixed assets purchased (CapEx outflow) Y4"
    },
    {
      "name": "cf_fixed_assets_purchased_y5",
      "sheet": "Cash Flow",
      "cell": "N15",
      "kind": "number",
      "unit": "INR Cr",
      "minimum": -1000000,
      "maximum": 0,
      "description": "Fixed assets purchased (CapEx outflow) Y5"
    },
    {
      "name": "peer1_mar_cap",
      "sheet": "peerdata",